{"meta":{"id":"bw_work_42c24f9cf68b0cf1","schemaVersion":"boreal.runtime.v1","createdAt":"2026-06-27T01:11:02.581Z","updatedAt":"2026-06-27T01:33:37.554Z","createdBy":{"id":"codex-v1-planner","kind":"agent","displayName":"codex-v1-planner"},"updatedBy":{"id":"codex-sprint02-executor","kind":"agent","displayName":"codex-sprint02-executor"},"sourceRefs":[],"tags":["v1-remainder","sprint-02","phase-02a","task","cli-ui","primitives","interactive","installer"],"contentHash":"sha256:b1ae8ba8c543ccd71ec8e6b2e029f3a9354ff7d4b2175b5f295cd85d4b3fecbd"},"kind":"task","title":"S02T02 - Implement stepper, shortcut hint, and windowed choice list primitives","description":"Add reusable wizard/list renderers with active descriptions and stable window sizing.","status":"closed","priority":"high","acceptanceCriteria":["Long lists do not resize the terminal unexpectedly.","Keyboard hints use consistent wording across views."],"labels":["v1-remainder","sprint-02","phase-02a","task","cli-ui","primitives","interactive","installer"],"dependencyIds":["bw_work_3e4ef779557f2eab"],"evidenceIds":["bw_evidence_267997d9953e22cd"],"verificationIds":["bw_verification_bebe458cac607944"],"closedAt":"2026-06-27T01:33:37.554Z","closedReason":"Stepper, shortcut hint, and windowed choice list primitives are implemented and tested."}
