{"meta":{"id":"bw_work_b09849054f44389f","schemaVersion":"boreal.runtime.v1","createdAt":"2026-06-27T01:11:19.853Z","updatedAt":"2026-06-27T04:42:11.516Z","createdBy":{"id":"codex-v1-planner","kind":"agent","displayName":"codex-v1-planner"},"updatedBy":{"id":"cybertron","kind":"human","displayName":"cybertron"},"sourceRefs":[],"tags":["v1-remainder","sprint-05","phase-05b","task","global-dashboard","overview","registry","multi-project"],"contentHash":"sha256:8b16399bcc3b94b3cc13fa6b75b65e26ec993ce298375f491f104f21ace78175"},"kind":"task","title":"S05T06 - Implement global search and actor activity panels","description":"Provide search results and actor/session activity across registered projects with clear source boundaries.","status":"closed","priority":"high","acceptanceCriteria":["Search results include project identity and source kind.","Activity panel distinguishes human, agent, and system operations."],"labels":["v1-remainder","sprint-05","phase-05b","task","global-dashboard","overview","registry","multi-project"],"dependencyIds":["bw_work_7c7ce47e834467bc"],"evidenceIds":["bw_evidence_f516247e501e9553"],"verificationIds":["bw_verification_1cb84f7cc2c5d11e"],"closedAt":"2026-06-27T04:42:11.516Z","closedReason":"Global search rows keep project identity/source kind, activity rows distinguish human/agent/system operations, and stale recovery lock acquisition now retries ENOENT races."}
