{"meta":{"id":"bw_work_d9206f856b2f7b2b","schemaVersion":"boreal.runtime.v1","createdAt":"2026-07-07T14:42:33.388Z","updatedAt":"2026-07-07T14:42:33.389Z","createdBy":{"id":"cybertron","kind":"human","displayName":"cybertron"},"updatedBy":{"id":"cybertron","kind":"human","displayName":"cybertron"},"sourceRefs":[{"uri":"raw:bw_source_30df83ca77b1de1c26d9b8feaf44434b"}],"tags":["hardening-pass-2","audit-2026-07-07","hardening","tui","global","operator-ux"],"contentHash":"sha256:3145f59fabeefbec69ef0bedf4c8331cf17e2656ab777214b6fffc154e9a9570"},"kind":"issue","title":"Global overview attention rows advertise open but Enter is a no-op","description":"Evidence: all routes receive drill binding/footer hints, global.overview reports active list length from attention, and the table renders with a cursor; handleDrill has cases for repo routes, global.projects, and global.queues, but not global.overview. Impact: the main global alert list is keyboard-selectable but not actionable.","status":"ready","priority":"normal","acceptanceCriteria":["Enter on a global overview attention row opens the relevant project/health context, or the route removes cursor/drill affordances.","A route-shell test covers the chosen behavior."],"labels":["hardening-pass-2","audit-2026-07-07","hardening","tui","global","operator-ux"],"dependencyIds":[],"evidenceIds":[],"verificationIds":[]}
