{"meta":{"id":"bw_work_097d001fc0e2eda1","schemaVersion":"boreal.runtime.v1","createdAt":"2026-06-27T01:11:22.540Z","updatedAt":"2026-06-27T05:43:21.091Z","createdBy":{"id":"codex-v1-planner","kind":"agent","displayName":"codex-v1-planner"},"updatedBy":{"id":"cybertron","kind":"human","displayName":"cybertron"},"sourceRefs":[],"tags":["v1-remainder","sprint-06","phase-06a","task","sprint-commands","board-contract","sprint-dashboard","kanban","work-execution"],"contentHash":"sha256:7672caf4e08203bcc2500591b40e95a4f922cc44d7fc9a4942cfb0a4621d5ea4"},"kind":"task","title":"S06T01 - Add sprint list/show/current/activate command contracts","description":"Implement or finalize commands to select the active sprint and expose its work scope without relying on labels alone.","status":"closed","priority":"critical","acceptanceCriteria":["Commands are JSON-first and workspace-scoped.","Activation records an operation/event and can be audited."],"labels":["v1-remainder","sprint-06","phase-06a","task","sprint-commands","board-contract","sprint-dashboard","kanban","work-execution"],"dependencyIds":["bw_work_cb8a4b593513de10"],"evidenceIds":["bw_evidence_778a6bcefbc0ae8b"],"verificationIds":["bw_verification_124d450441b55f67"],"closedAt":"2026-06-27T05:43:21.091Z","closedReason":"S06T01 acceptance met: sprint commands are JSON-first and workspace-scoped; activation records auditable projection/event state; docs and tests cover contracts."}
