{"meta":{"id":"bw_work_f1dce9a545528299","schemaVersion":"boreal.runtime.v1","createdAt":"2026-07-01T03:25:33.572Z","updatedAt":"2026-07-01T15:59:06.825Z","createdBy":{"id":"cybertron","kind":"human","displayName":"cybertron"},"updatedBy":{"id":"cybertron","kind":"human","displayName":"cybertron"},"sourceRefs":[],"tags":["agent-directives","sprint-02","phase-02c","phase","blocked","handoff","doctor"],"contentHash":"sha256:91682ed9e4f22c155140471474306fc9bd6dabc48200b3f3c78b426aa492c3cd"},"kind":"milestone","title":"Phase 02C - Blocked, doctor, handoff, and workflow-next directives","description":"Extend compiler coverage beyond closeout to blocked work, recovery, handoff, and next workflow recommendations.","status":"closed","priority":"high","acceptanceCriteria":["Blocked, doctor recovery, session/project handoff, workflow show, work next, and sync paths emit structured required or recommended directives.","Conflict detection covers incompatible next actions, blocked directives, and missing required context."],"labels":["agent-directives","sprint-02","phase-02c","phase","blocked","handoff","doctor"],"dependencyIds":["bw_work_0104fb19a9253b73","bw_work_84aed5746b6e16e8","bw_work_ac21d6f37eb204e2","bw_work_aaf62b5b049152db"],"evidenceIds":["bw_evidence_d5d76ec77f7ea2b2","bw_evidence_7fad347e628ac81c","bw_evidence_7f0168a318c7baa7"],"verificationIds":["bw_verification_0da33ef326829b26"],"closedAt":"2026-07-01T15:55:38.967Z","closedReason":"completed: Phase 02C child work closed with blocked, doctor recovery, handoff, workflow-next, and runtime integration coverage verified"}
