{"meta":{"id":"bw_work_2371d5ee38084c14","schemaVersion":"boreal.runtime.v1","createdAt":"2026-07-02T21:52:49.165Z","updatedAt":"2026-07-02T23:01:42.083Z","createdBy":{"id":"cybertron","kind":"human","displayName":"cybertron"},"updatedBy":{"id":"cybertron","kind":"human","displayName":"cybertron"},"sourceRefs":[],"tags":["hardening-mission","sprint-h2","evidence"],"contentHash":"sha256:d62dcc08d5ae4d71ee5eba23ebbe2be97c1a1319b194f1d56cebdf5146044441"},"kind":"task","title":"Auto-capture git evidence at agent finish","description":"Context: a 2h47m dabble-employee-app agent session made 300 CLI calls with 24 failures. Failure clusters: 117 read-only work show polls (~40% of all calls), 14 identical failed sync refresh retries, 6 vault init retries, 66 agent finish calls with only 2 standalone evidence records, 6 NOT_FOUND finish/release (ownership confusion), 1 CONFLICT claim, 2 POLICY_VIOLATION sprint closes. Design principle for this mission: every response (success or error) must carry enough state that the correct next action is derivable without another read, and the honest path (evidence, ownership, health) must be the path of least resistance. Problem: 66 finishes produced 2 standalone evidence records; closed does not mean verified. Change: when agent finish runs inside a git repo, automatically capture HEAD SHA, current branch, and dirty status from the execution root and attach it as a command/diff evidence record on the work item, without requiring the agent to do anything. Where: finish handler in apps/cli/src/commands.ts plus evidence creation via the existing evidence machinery; git probing likely already exists for the git health checks (docs/architecture/GIT_HEALTH_HARDENING.md describes current git awareness). Constraint: must degrade gracefully outside a git repo (skip with a note, not an error); must record the execution root path so lane-isolation work can later distinguish lane worktrees; do not block finish if git probing fails, just annotate.","status":"closed","priority":"high","acceptanceCriteria":["agent finish in a git repo attaches an evidence record with HEAD SHA, branch, and dirty status automatically","Finish outside a git repo succeeds with an explicit no-git note instead of evidence","Git probe failure annotates the finish but never blocks it"],"labels":["hardening-mission","sprint-h2","evidence"],"requiredCloseoutGates":[{"id":"bw_gate_6856ec3024426a9f","subjectType":"work","subjectId":"bw_work_2371d5ee38084c14","kind":"verification","scope":"self","status":"satisfied","requiredEvidenceKinds":["command","test","diff","review","artifact"],"requiredOutcome":"passed","minEvidenceCount":1,"createdAt":"2026-07-02T21:52:49.165Z","createdBy":{"id":"cybertron","kind":"human","displayName":"cybertron"},"satisfiedBy":{"evidenceIds":["bw_evidence_d8be1beda190f7b6"],"verificationIds":["bw_verification_33d3b9c3d717d85b"],"agentSummaryIds":[],"commitShas":[],"dirtyPathNotes":[]}}],"dependencyIds":[],"evidenceIds":["bw_evidence_d8be1beda190f7b6","bw_evidence_5a8b28d31329dd65"],"verificationIds":["bw_verification_33d3b9c3d717d85b"],"closedAt":"2026-07-02T23:01:40.655Z","closedReason":"Completed for runtime hardening milestone."}
