{"meta":{"id":"bw_work_64cbeba31ce6aeca","schemaVersion":"boreal.runtime.v1","createdAt":"2026-07-02T03:38:08.633Z","updatedAt":"2026-07-02T06:19:22.819Z","createdBy":{"id":"cybertron","kind":"human","displayName":"cybertron"},"updatedBy":{"id":"cybertron","kind":"human","displayName":"cybertron"},"sourceRefs":[{"uri":"docs/architecture/AUDIT_2026-07-01_ACCOUNTABILITY_AND_AGENT_CONTEXT.md"},{"uri":"packages/core/src/agent-directive-registry.ts"},{"uri":"schemas/directives/agent-directive-bundle.schema.json"}],"tags":["directive-refactor","sprint-3","taxonomy"],"contentHash":"sha256:6855c0b80902f45beb2c32ac3308d96e063fa74c31f0a7ecd2e4d214c9d822c8"},"kind":"task","title":"Replace dataRequirements with typed payload interfaces","description":"WHY: registry entries declare their data with a stringly-typed mini-schema (requirement(blockerIds, array, true, ...) in packages/core/src/agent-directive-registry.ts lines 68-77 and siblings), which is a third representation alongside the TS types and schemas/directives JSON schema - three places to drift. WHAT: give each directive (equivalently each gap code) a typed payload interface in TS as the single source, generate or derive the JSON schema from those types (or validate fixtures against hand-written schema in CI so drift fails the build), and delete the requirement() helper and its runtime checking in the compiler. The gap payloads defined in sprint 2 task one should already be these types; this task aligns the registry side to consume them directly.","status":"closed","priority":"normal","acceptanceCriteria":["requirement() helper and dataRequirements arrays are deleted from the registry","Each gap code has one TS payload type consumed by both emitter and registry, with schema drift covered by a CI test","pnpm test passes","Commit checkpoint SHA recorded"],"labels":["directive-refactor","sprint-3","taxonomy"],"requiredCloseoutGates":[{"id":"bw_gate_e0ccae30b16bcd0a","subjectType":"work","subjectId":"bw_work_64cbeba31ce6aeca","kind":"verification","scope":"self","status":"satisfied","requiredEvidenceKinds":["command","test","diff","review","artifact"],"requiredOutcome":"passed","minEvidenceCount":1,"createdAt":"2026-07-02T03:38:08.633Z","createdBy":{"id":"cybertron","kind":"human","displayName":"cybertron"},"satisfiedBy":{"evidenceIds":["bw_evidence_8f5237a01801a3bd"],"verificationIds":["bw_verification_9e8e125ca883edf6"],"agentSummaryIds":[],"commitShas":[],"dirtyPathNotes":[]}}],"dependencyIds":["bw_work_f8bec47babe97008"],"evidenceIds":["bw_evidence_8f5237a01801a3bd"],"verificationIds":["bw_verification_9e8e125ca883edf6"],"closedAt":"2026-07-02T06:19:22.819Z","closedReason":"Typed payload contract migration complete and verified."}
