{"meta":{"id":"bw_work_3cc50623d36aa119","schemaVersion":"boreal.runtime.v1","createdAt":"2026-07-07T14:42:28.236Z","updatedAt":"2026-07-10T14:02:20.008Z","createdBy":{"id":"cybertron","kind":"human","displayName":"cybertron"},"updatedBy":{"id":"cybertron","kind":"human","displayName":"cybertron"},"sourceRefs":[{"uri":"raw:bw_source_30df83ca77b1de1c26d9b8feaf44434b"}],"tags":["hardening-pass-2","audit-2026-07-07","hardening","ci","tests","doctor"],"contentHash":"sha256:87fac672296764199846a9bed0cecb64bc09b811a1f17251a69ddc96412fec1c"},"kind":"issue","title":"PR workflow skips runtime tests and strict doctor gates","description":"Evidence: .github/workflows/npm-publish-dry-run.yml runs install, pnpm check, npm smoke, and dry-run only; package.json exposes pnpm test and doctor:strict, and README documents both as hardening gates. Impact: PRs can pass the only workflow while breaking runtime behavior covered by Vitest or strict workspace diagnostics.","status":"closed","priority":"high","acceptanceCriteria":["CI runs pnpm test on PRs and includes a fixture-backed non-mutating strict doctor gate.","Package smoke/dry-run remains after runtime gates so release packaging is tested only after core health passes."],"labels":["hardening-pass-2","audit-2026-07-07","hardening","ci","tests","doctor"],"dependencyIds":[],"evidenceIds":["bw_evidence_a9b66f1cd54aebe9","bw_evidence_36247338137980bf","bw_evidence_f21cf5d253fa864d"],"verificationIds":["bw_verification_10be2d3cef1e949c"],"closedAt":"2026-07-10T14:00:30.133Z","closedReason":"Runtime and strict-doctor gates now precede release packaging in PR CI, with 525 tests passing."}
