{"meta":{"id":"bw_work_a99e751b23f33287","schemaVersion":"boreal.runtime.v1","createdAt":"2026-07-01T03:27:20.032Z","updatedAt":"2026-07-01T16:00:30.986Z","createdBy":{"id":"cybertron","kind":"human","displayName":"cybertron"},"updatedBy":{"id":"cybertron","kind":"human","displayName":"cybertron"},"sourceRefs":[],"tags":["agent-directives","sprint-02","phase-02b","task","git"],"contentHash":"sha256:718f9559956f0a8b128dd53823c913b61b86d915408704966ac38add8dbc8401"},"kind":"task","title":"S02T06 - Compile git checkpoint and dirty-state directives","description":"Emit commit SHA, dirty-path, protected-branch, no-repo-change, and no-commit-reason obligations from git/sync state.","status":"closed","priority":"high","acceptanceCriteria":["Repository-changing work receives commit-or-reason directives with typed commitShas, dirtyPathNotes, protected-branch caveats, and out-of-scope repo notes."],"labels":["agent-directives","sprint-02","phase-02b","task","git"],"dependencyIds":["bw_work_f50e1f6e26b1986c"],"evidenceIds":["bw_evidence_9554a5088be1260a","bw_evidence_c7436d3816551fb2"],"verificationIds":["bw_verification_c09d99a1832dbe91"],"closedAt":"2026-07-01T15:11:52.251Z","closedReason":"Completed S02T06 git checkpoint and dirty-state directive compilation"}
