{"meta":{"id":"bw_work_3ec57adac55abd82","schemaVersion":"boreal.runtime.v1","createdAt":"2026-06-27T01:10:58.479Z","updatedAt":"2026-06-27T12:31:28.010Z","createdBy":{"id":"codex-v1-planner","kind":"agent","displayName":"codex-v1-planner"},"updatedBy":{"id":"cybertron","kind":"human","displayName":"cybertron"},"sourceRefs":[],"tags":["v1-remainder","bucket","dashboard","runtime-hardening","release"],"contentHash":"sha256:746214a11cc9b6d31b165a7f18b581318b029eba42f76c3690cfd4818738a2a4"},"kind":"milestone","title":"V1 Completion Bucket - dashboards, runtime hardening, scoped integrations","description":"Remainder bucket created from the live Boreal state after install: no open work, doctor clean, existing CLI/workflow/skill scaffolding present, dashboard apps mostly empty, and Components.dc.html containing 177 dashboard/design-system screens.","status":"closed","priority":"critical","acceptanceCriteria":["All v1 dashboard, CLI dashboard, runtime hardening, scoped integration, and release sprints are closed with passing evidence.","Doctor, sync refresh, command docs, and end-to-end fixture tests pass before v1 closeout."],"labels":["v1-remainder","bucket","dashboard","runtime-hardening","release"],"dependencyIds":["bw_work_14111c7345395dd2","bw_work_1c08821f3f662232","bw_work_27c391ede42960e8","bw_work_2b9baa907aa24c27","bw_work_3e4ef779557f2eab","bw_work_3ea8b47e0d33d987","bw_work_5d61b84c8d43c6a9","bw_work_a159117052d5ee40","bw_work_cb8a4b593513de10","bw_work_e6f837a71ac49529"],"evidenceIds":["bw_evidence_2b61fac023aa4d9e"],"verificationIds":["bw_verification_14d3f93a9a438f7d"],"closedAt":"2026-06-27T12:31:28.010Z","closedReason":"V1 completion bucket closed: all v1-remainder sprint dependencies are closed with final doctor/test/console/daemon/MCP evidence."}
