{"meta":{"id":"bw_work_239b559b327ab25d","schemaVersion":"boreal.runtime.v1","createdAt":"2026-06-27T01:11:33.755Z","updatedAt":"2026-06-27T09:24:11.855Z","createdBy":{"id":"codex-v1-planner","kind":"agent","displayName":"codex-v1-planner"},"updatedBy":{"id":"cybertron","kind":"human","displayName":"cybertron"},"sourceRefs":[],"tags":["v1-remainder","sprint-08","phase-08a","phase","sqlite","rebuild"],"contentHash":"sha256:ba3403a894ece4dbbe73cf08d8bef66fcd39b68ea73adad0d5302d78ea3dcb8c"},"kind":"milestone","title":"Phase 08A - Canonical rebuild and SQLite cache adapter","description":"Phase gate for Sprint 08 - Runtime storage and collaboration hardening.","status":"closed","priority":"critical","acceptanceCriteria":["All phase tasks are closed with evidence or explicitly deferred.","Phase output is reflected in docs/tests/commands when relevant."],"labels":["v1-remainder","sprint-08","phase-08a","phase","sqlite","rebuild"],"dependencyIds":["bw_work_181b9a5b886addcb","bw_work_c85cf267e9a20c67","bw_work_bc5f45766cc5d4ea"],"evidenceIds":["bw_evidence_2a1c3f01dd9c13b0"],"verificationIds":["bw_verification_92b17751d67e282d"],"closedAt":"2026-06-27T09:24:11.855Z","closedReason":"Phase 08A complete: canonical rebuild semantics, SQLite generated cache adapter, doctor integration, and thousands-record cache hardening tests are implemented and verified."}
