{"meta":{"id":"bw_work_9ef6934194be3516","schemaVersion":"boreal.runtime.v1","createdAt":"2026-07-03T20:44:26.192Z","updatedAt":"2026-07-04T07:42:04.141Z","createdBy":{"id":"cybertron","kind":"human","displayName":"cybertron"},"updatedBy":{"id":"cybertron","kind":"human","displayName":"cybertron"},"sourceRefs":[],"tags":["agent-loop-hardening","hardening-s4"],"contentHash":"sha256:7dbcc513c650adbc5ac770ffb1c3912c94e4df8023053183eef91c3b39cd0f6f"},"kind":"sprint","title":"Hardening S4: Golden-path workflows and one-shot closeout","description":"Both audited agents used the manual 5-step closeout because the work was unreserved and closeout-work.md never prescribes gate closeout or agent finish in its steps. Rewrite workflows around the one-shot paths and close the unreserved-work gap. Depends on S1 (stable envelopes) and S2 (gate-scoped health).","status":"closed","priority":"normal","acceptanceCriteria":["All child tasks closed with commit checkpoints","Documented golden path closes a task in one bwrk command and a sprint in at most 4"],"labels":["agent-loop-hardening","hardening-s4"],"dependencyIds":["bw_work_104e5f9a54410b7e","bw_work_25f49d2c2a07c396","bw_work_3ae789cea5fc8f40","bw_work_750a67aa09e8ebd9","bw_work_77971342b74d3615","bw_work_f14baaa786e881c4","bw_work_2f07afe4a207a46f"],"evidenceIds":["bw_evidence_78576a06514c7658","bw_evidence_0778b889c5fd0fd2"],"verificationIds":["bw_verification_fefc93a1ba304c5d"],"closedAt":"2026-07-04T07:42:04.141Z","closedReason":"completed S4 golden-path workflow hardening"}
