{"meta":{"id":"bw_work_af3ced730f470a9e","schemaVersion":"boreal.runtime.v1","createdAt":"2026-07-01T03:19:45.923Z","updatedAt":"2026-07-01T13:57:15.145Z","createdBy":{"id":"cybertron","kind":"human","displayName":"cybertron"},"updatedBy":{"id":"cybertron","kind":"human","displayName":"cybertron"},"sourceRefs":[],"tags":["agent-directives","sprint-01","phase-01a","phase","architecture"],"contentHash":"sha256:71991fabbfa7bc847652182f7542c784a1041badf92d1aacfdb363369e8e475e"},"kind":"milestone","title":"Phase 01A - Directive architecture and safety contract","description":"Define the authoritative directive contract, precedence, safety model, and final-product scope before implementation.","status":"closed","priority":"critical","acceptanceCriteria":["docs/architecture/AGENT_DIRECTIVES.md defines trusted instruction registry boundaries, dynamic data rules, precedence, conflict handling, and command envelope expectations.","The plan references the closed review/audit gate sprint as prerequisite truth and does not duplicate gate-policy work."],"labels":["agent-directives","sprint-01","phase-01a","phase","architecture"],"dependencyIds":["bw_work_18bd82caaa659c9d","bw_work_d3415afb9c29a1c7","bw_work_ef26450108a622ce"],"evidenceIds":["bw_evidence_4b5d35238c07233d","bw_evidence_4fa1582d55fdb412"],"verificationIds":["bw_verification_9220c62326c4ad7e"],"closedAt":"2026-07-01T04:23:37.643Z","closedReason":"Phase 01A complete from closed architecture child tasks and prerequisite gate-truth validation"}
