{"meta":{"id":"bw_work_d94310945c2a4cbb","schemaVersion":"boreal.runtime.v1","createdAt":"2026-07-07T14:39:39.850Z","updatedAt":"2026-07-07T14:39:39.851Z","createdBy":{"id":"cybertron","kind":"human","displayName":"cybertron"},"updatedBy":{"id":"cybertron","kind":"human","displayName":"cybertron"},"sourceRefs":[{"uri":"raw:bw_source_30df83ca77b1de1c26d9b8feaf44434b"}],"tags":["hardening-pass-2","audit-2026-07-07","hardening","storage","event-log","export"],"contentHash":"sha256:9db82b42f91729ec6fad390c208119a222594334a2e91c95c521ffcdcc2b6d8f"},"kind":"issue","title":"Rotated event-log archives are invisible to runtime history readers","description":"Evidence: FileEventLog exposes readAllIncludingArchives, but FileBorealStore and ObjectDirBorealStore hydrate snapshots with live-only readAll; export/snapshot/ledger/operation paths then consume those store snapshots. Impact: after rotation, prior runtime events and operations disappear from operation list, doctor causality checks, exports, snapshots, ledgers, and migration snapshots.","status":"ready","priority":"high","acceptanceCriteria":["Historical event/operation readers use archive-aware event-log reads where full history is required.","Tests rotate a log and still see pre-rotation history in operation list, export json, and export ledgers."],"labels":["hardening-pass-2","audit-2026-07-07","hardening","storage","event-log","export"],"dependencyIds":[],"evidenceIds":[],"verificationIds":[]}
