{"meta":{"id":"bw_work_4d2074fb3e18a3ff","schemaVersion":"boreal.runtime.v1","createdAt":"2026-07-05T12:57:43.495Z","updatedAt":"2026-07-05T12:58:12.748Z","createdBy":{"id":"cybertron","kind":"human","displayName":"cybertron"},"updatedBy":{"id":"cybertron","kind":"human","displayName":"cybertron"},"sourceRefs":[],"tags":["sprint","search-collab"],"contentHash":"sha256:cb618addc9454df3ab1724962a94d50fb7bbfc8d40eda96bfd68e1c17238fd32"},"kind":"sprint","title":"Sprint: Search & Collab v1","description":"","status":"blocked","priority":"normal","acceptanceCriteria":["Every task closed with command evidence, verification, and a scoped git checkpoint SHA or explicit no-commit reason code; final closeout summary records per-task outcomes"],"labels":["sprint","search-collab"],"parentId":"bw_work_8f671bf4c9b165e1","dependencyIds":["bw_work_22381c9ddbc13bf0","bw_work_326532450181b676","bw_work_4ef420806f403b5e","bw_work_7682e978c8b2c08e","bw_work_7a78a4b7d9c25f4d","bw_work_928d7251af2a0422","bw_work_a144a8bd521545ab","bw_work_a29c59951564c071","bw_work_ccf8620fa3250a58","bw_work_f50c6596bde56fbf","bw_work_fa807f5f40585286","bw_work_ae35c6a76db5f6e0"],"evidenceIds":[],"verificationIds":[]}
