{"meta":{"id":"bw_work_caa619f2ed9b24e7","schemaVersion":"boreal.runtime.v1","createdAt":"2026-06-30T23:09:14.988Z","updatedAt":"2026-07-02T16:35:40.992Z","createdBy":{"id":"cybertron","kind":"human","displayName":"cybertron"},"updatedBy":{"id":"cybertron","kind":"human","displayName":"cybertron"},"sourceRefs":[{"uri":"bw_source_294ebb9e614519a1d85dcd375cb22582"}],"tags":["doctor","sync","dogfood","race","closeout"],"contentHash":"sha256:3c99d03b78fa6537034f0e0d53088935b63d8ec9abdd07f5a337bec555715183"},"kind":"issue","title":"Make strict doctor and sync refresh concurrency safe for gates","description":"Dogfooding anomaly: running bwrk sync refresh --json and bwrk doctor --strict --json concurrently can make doctor report stale ledger/cache/search/context projection warnings while sync is actively rebuilding and later succeeds. This creates noisy or misleading closeout/gate failures. Scope: either serialize generated-artifact refresh before doctor in gate workflows, or make doctor detect active refresh locks and return a clear retry/active-refresh state instead of stale projection diagnostics.","status":"closed","priority":"high","acceptanceCriteria":["Gate workflows that run generated-artifact refresh and strict doctor do not produce misleading stale ledger/cache/search/context warnings while a refresh is active.","Doctor either waits/serializes appropriately or returns an explicit active-refresh/retry state when refresh locks are present.","The expected behavior is covered by a deterministic regression test or by committed documentation/behavior contract if a deterministic concurrent test is not practical."],"labels":["doctor","sync","dogfood","race","closeout"],"dependencyIds":[],"evidenceIds":["bw_evidence_ca4a1a2f3807df7d"],"verificationIds":["bw_verification_775bb6843d960e31"],"closedAt":"2026-07-02T16:35:40.992Z","closedReason":"verified concurrency gate behavior and recorded final summary"}
