{"meta":{"id":"bw_work_b91cf4678055202d","schemaVersion":"boreal.runtime.v1","createdAt":"2026-07-07T15:03:47.757Z","updatedAt":"2026-07-07T15:03:47.758Z","createdBy":{"id":"cybertron","kind":"human","displayName":"cybertron"},"updatedBy":{"id":"cybertron","kind":"human","displayName":"cybertron"},"sourceRefs":[{"uri":"bw_source_5051c6f0e4a185acbafd7b09573afc1d"}],"tags":["hardening-pass-3","audit-2026-07-07","hardening","security","closeout-gates","doctor","graph"],"contentHash":"sha256:68d67a6d9288bb13d61eb6af21985b82f95d8188a1862946ad624c1b68f5cb7d"},"kind":"issue","title":"Scoped required gates pass when target resolution is empty","description":"Runtime and doctor resolve direct_children/descendants gate targets from dependencyIds. If a container has parent-linked children only, missing dependency links, or projection drift, the target list can be empty and every() semantics mark the scoped gate satisfied without evidence.","status":"ready","priority":"high","acceptanceCriteria":["Non-self scoped gates emit a gate.scope.empty or target-missing gap when target resolution is empty unless explicitly forced with audited metadata.","Target resolution includes canonical dependency edges and parent scope consistently with sprint rollup membership.","Runtime and doctor tests prove parentId-only children cannot be skipped by direct_children/descendants gates."],"labels":["hardening-pass-3","audit-2026-07-07","hardening","security","closeout-gates","doctor","graph"],"dependencyIds":[],"evidenceIds":[],"verificationIds":[]}
