{"meta":{"id":"bw_work_c2fc1310c64c5c17","schemaVersion":"boreal.runtime.v1","createdAt":"2026-07-10T17:07:32.971Z","updatedAt":"2026-07-10T17:10:07.194Z","createdBy":{"id":"cybertron","kind":"human","displayName":"cybertron"},"updatedBy":{"id":"cybertron","kind":"human","displayName":"cybertron"},"sourceRefs":[],"tags":["competitive-parity","trustworthy-public-beta","s04","product","release"],"contentHash":"sha256:8aaffcef663c1f12646036c9baef98da3ae62f78af2d251981a1f8e350ca013e"},"kind":"sprint","title":"S04 - Independent Review, Acceptance, and Resumable Merge","description":"Add a complete reviewer lifecycle and safe merge orchestration that separates implementation from approval, preserves findings, and recovers interrupted integration.","status":"blocked","priority":"high","acceptanceCriteria":["Every child task is closed or explicitly deferred into source-linked follow-up work with a reason.","Sprint closeout reports child outcomes, evidence, verification, checkpoint SHAs or no-commit reasons, and remaining risks.","All repository changes are captured in one or more scoped Git checkpoint commits, or closeout records an accepted no-repo-changes reason.","Relevant automated tests, documentation checks, and strict Boreal health checks pass before closeout."],"labels":["competitive-parity","trustworthy-public-beta","s04","product","release"],"requiredCloseoutGates":[{"id":"bw_gate_4dcb7f7107c538fb","subjectType":"sprint","subjectId":"bw_work_c2fc1310c64c5c17","kind":"verification","scope":"descendants","status":"open","requiredEvidenceKinds":["command","test","diff","review","artifact"],"requiredOutcome":"passed","minEvidenceCount":1,"createdAt":"2026-07-10T17:07:32.971Z","createdBy":{"id":"cybertron","kind":"human","displayName":"cybertron"}},{"id":"bw_gate_31f8f8c627ba1615","subjectType":"sprint","subjectId":"bw_work_c2fc1310c64c5c17","kind":"checkpoint","scope":"descendants","status":"open","requiredEvidenceKinds":[],"requiredOutcome":"passed","minEvidenceCount":1,"createdAt":"2026-07-10T17:07:32.971Z","createdBy":{"id":"cybertron","kind":"human","displayName":"cybertron"}},{"id":"bw_gate_1affb3c5fccb5f08","subjectType":"sprint","subjectId":"bw_work_c2fc1310c64c5c17","kind":"review","scope":"self","status":"open","requiredEvidenceKinds":["review"],"requiredOutcome":"passed","minEvidenceCount":1,"createdAt":"2026-07-10T17:07:32.971Z","createdBy":{"id":"cybertron","kind":"human","displayName":"cybertron"}}],"dependencyIds":["bw_work_14fe0d5b8c160743","bw_work_6a00769cb6c46b80","bw_work_7a38f0a77aa2d69d","bw_work_de5c25efdef3222b","bw_work_f9e21f5ba759eeb2","bw_work_fbb7ff20bb7e56cf","bw_work_1336bf9172fa2f75"],"evidenceIds":[],"verificationIds":[]}
