{"meta":{"id":"bw_work_a144a8bd521545ab","schemaVersion":"boreal.runtime.v1","createdAt":"2026-07-05T12:57:58.510Z","updatedAt":"2026-07-05T21:34:59.481Z","createdBy":{"id":"cybertron","kind":"human","displayName":"cybertron"},"updatedBy":{"id":"cybertron","kind":"human","displayName":"cybertron"},"sourceRefs":[],"tags":["search-collab"],"contentHash":"sha256:d2bd8854172f5cb812708da8944fe577cd2e1a249f6a2d0ed19e464aac9a2120"},"kind":"task","title":"T11 global status across projects","description":"Plan task in docs/superpowers/plans/2026-07-05-search-worktrees-collab.md (T11)","status":"closed","priority":"normal","acceptanceCriteria":["bwrk global status summarizes each registered project read-only, tolerates broken projects, --strict gates exit code; scoped git checkpoint committed"],"labels":["search-collab"],"dependencyIds":[],"evidenceIds":["bw_evidence_5e7b28fa1a30e203","bw_evidence_438e0cabd05ad9ae"],"verificationIds":["bw_verification_b2d96c28fecb97e9"],"closedAt":"2026-07-05T21:34:59.124Z","closedReason":"Global status command implemented and verified."}
