{"meta":{"id":"bw_work_2fe269a85a304487","schemaVersion":"boreal.runtime.v1","createdAt":"2026-07-02T17:36:17.216Z","updatedAt":"2026-07-02T19:31:57.244Z","createdBy":{"id":"cybertron","kind":"human","displayName":"cybertron"},"updatedBy":{"id":"cybertron","kind":"human","displayName":"cybertron"},"sourceRefs":[{"uri":"docs/product/GLOBAL_MANAGER_DESIGN.md"},{"uri":"packages/storage/src/file-store.ts"}],"tags":["distribution","sprint-g2","packaging"],"contentHash":"sha256:f00da6ddab39b00235a49c08d82ef909db7ec091cf284b173aad92a957cab3c7"},"kind":"task","title":"Version-skew policy - handshake doctor integration and floor behavior","description":"WHY: three install scopes mean multiple bwrk versions will coexist on one machine; skew must be visible and bounded, never silent. WHAT: (1) define and document the compatibility contract: which version may operate on which state schemaVersion, what delegation guarantees, and what happens when a newer state file meets an older binary (the existing fail-closed schema rejection stays the hard backstop - packages/storage/src/file-store.ts documentToSnapshot); (2) doctor diagnostics: warn when the machine binary and a repo-pinned version differ by more than a patch, error when a binary meets a state schema it does not support, both with channel-correct upgrade commands using the channel detection from the dist-build task; (3) floor behavior when delegation is unavailable (pinned binary missing because node_modules is not installed): hard typed error naming pnpm install rather than silently running the machine version against the pinned repo; (4) document the policy in docs (getting-started install section plus a short compatibility note in docs/architecture). This task is the safety net that makes the tier system honest.","status":"closed","priority":"normal","acceptanceCriteria":["Doctor reports skew warnings and schema errors with channel-correct upgrade commands, covered by fixture tests","A pinned repo without installed node_modules produces a typed error naming the install command instead of falling back to the machine binary","Compatibility contract documented","Commit checkpoint SHA recorded"],"labels":["distribution","sprint-g2","packaging"],"requiredCloseoutGates":[{"id":"bw_gate_6265b8bffe364429","subjectType":"work","subjectId":"bw_work_2fe269a85a304487","kind":"verification","scope":"self","status":"satisfied","requiredEvidenceKinds":["command","test","diff","review","artifact"],"requiredOutcome":"passed","minEvidenceCount":1,"declaredCommand":"pnpm check","expectedObservable":"pnpm check passed","createdAt":"2026-07-02T17:36:17.216Z","createdBy":{"id":"cybertron","kind":"human","displayName":"cybertron"},"satisfiedBy":{"evidenceIds":["bw_evidence_5d11937e72070655"],"verificationIds":["bw_verification_099d766ebc99b5ce"],"agentSummaryIds":[],"commitShas":[],"dirtyPathNotes":[]}}],"dependencyIds":["bw_work_e18576ee0b941f1c"],"evidenceIds":["bw_evidence_5d11937e72070655"],"verificationIds":["bw_verification_099d766ebc99b5ce"],"closedAt":"2026-07-02T19:31:57.244Z","closedReason":"completed acceptance criteria"}
