{"meta":{"id":"bw_work_1743f7a8c376717e","schemaVersion":"boreal.runtime.v1","createdAt":"2026-07-10T17:07:26.124Z","updatedAt":"2026-07-13T06:00:47.861Z","createdBy":{"id":"cybertron","kind":"human","displayName":"cybertron"},"updatedBy":{"id":"cybertron","kind":"human","displayName":"cybertron"},"sourceRefs":[],"tags":["competitive-parity","trustworthy-public-beta","s02t05","s02"],"contentHash":"sha256:7bc87286333b1e3606a67e27b979359028ef624150dcf441b180fa50754f8453"},"kind":"task","title":"S02T05 - Add CI attestations, trust reporting, trace views, and end-to-end tests","description":"Import signed or source-linked CI results, render trust levels across CLI/console/export, and prove the full witnessed closeout path including tamper, replay, and failure cases.","status":"closed","priority":"high","acceptanceCriteria":["External CI and human attestations preserve issuer, subject revision, result URI, and verification status without impersonating Boreal-witnessed execution.","CLI, console, Markdown export, and trace output show evidence trust and freshness consistently.","End-to-end fixtures cover success, failure, timeout, tampering, stale commits, output truncation, and replay attempts.","All repository changes are captured in one or more scoped Git checkpoint commits, or closeout records an accepted no-repo-changes reason.","Relevant automated tests, documentation checks, and strict Boreal health checks pass before closeout."],"labels":["competitive-parity","trustworthy-public-beta","s02t05","s02"],"requiredCloseoutGates":[{"id":"bw_gate_fcdf9969095d3864","subjectType":"work","subjectId":"bw_work_1743f7a8c376717e","kind":"verification","scope":"self","status":"satisfied","requiredEvidenceKinds":["command","test","diff","review","artifact"],"requiredOutcome":"passed","minEvidenceCount":1,"createdAt":"2026-07-10T17:07:26.124Z","createdBy":{"id":"cybertron","kind":"human","displayName":"cybertron"},"satisfiedBy":{"evidenceIds":["bw_evidence_6d340c82be57f2ac"],"verificationIds":["bw_verification_b5e5be77db66f613"],"agentSummaryIds":[],"commitShas":[],"dirtyPathNotes":[]}},{"id":"bw_gate_09353a5c276c66a7","subjectType":"work","subjectId":"bw_work_1743f7a8c376717e","kind":"checkpoint","scope":"self","status":"satisfied","requiredEvidenceKinds":[],"requiredOutcome":"passed","minEvidenceCount":1,"createdAt":"2026-07-10T17:07:26.124Z","createdBy":{"id":"cybertron","kind":"human","displayName":"cybertron"},"satisfiedBy":{"evidenceIds":["bw_evidence_6d340c82be57f2ac"],"verificationIds":["bw_verification_b5e5be77db66f613"],"agentSummaryIds":["bw_summary_afdde0fcc435dfc1"],"commitShas":["b469b6288d1f0a55ee78177db1d7a6d9b3452864"],"dirtyPathNotes":[]}}],"dependencyIds":["bw_work_142a37a3c8028ff3"],"evidenceIds":["bw_evidence_6d340c82be57f2ac","bw_evidence_1e45b21d1d5b923d"],"verificationIds":["bw_verification_b5e5be77db66f613"],"closedAt":"2026-07-13T06:00:47.511Z","closedReason":"Attestation reporting and end-to-end proof completed; serial full suite passed."}
