{"meta":{"id":"bw_work_8b936d89babd0334","schemaVersion":"boreal.runtime.v1","createdAt":"2026-06-27T01:11:05.117Z","updatedAt":"2026-06-27T01:57:44.018Z","createdBy":{"id":"codex-v1-planner","kind":"agent","displayName":"codex-v1-planner"},"updatedBy":{"id":"codex-sprint02-executor","kind":"agent","displayName":"codex-sprint02-executor"},"sourceRefs":[],"tags":["v1-remainder","sprint-02","phase-02c","task","doctor","sync","agent","work-next","cli-ui","interactive","installer"],"contentHash":"sha256:ff3478e42c424949ba2e58079d60ef6f81ef75373d7a0565c9b7b2e9728f633a"},"kind":"task","title":"S02T08 - Add sync, lock, and agent status dashboard views","description":"Expose sync health, stale locks, reservation TTLs, active work, and next recommended command in rich terminal form.","status":"closed","priority":"high","acceptanceCriteria":["Lock conflicts include owner path, stale/fresh state, and exact repair command.","Agent status view handles no active reservation and expired active reservations clearly."],"labels":["v1-remainder","sprint-02","phase-02c","task","doctor","sync","agent","work-next","cli-ui","interactive","installer"],"dependencyIds":["bw_work_b4845319e4ec3a0e"],"evidenceIds":["bw_evidence_ff514a639a71b2b6"],"verificationIds":["bw_verification_e024b085cf847571"],"closedAt":"2026-06-27T01:57:44.018Z","closedReason":"Sync, lock, and agent status dashboard views are implemented and covered by CLI regression tests."}
