{"meta":{"id":"bw_work_608a261817b6c8b5","schemaVersion":"boreal.runtime.v1","createdAt":"2026-07-07T15:03:44.558Z","updatedAt":"2026-07-07T15:03:44.558Z","createdBy":{"id":"cybertron","kind":"human","displayName":"cybertron"},"updatedBy":{"id":"cybertron","kind":"human","displayName":"cybertron"},"sourceRefs":[{"uri":"bw_source_5051c6f0e4a185acbafd7b09573afc1d"}],"tags":["hardening-pass-3","audit-2026-07-07","hardening","security","daemon","reservations","audit"],"contentHash":"sha256:bc7028512d72cd3a1f84882088143e0060d67342b0d6652d59ae277b2004576a"},"kind":"issue","title":"Daemon watch renews reservations while reporting no truth writes","description":"The daemon architecture says it is an observer and status reports writesTruth: false, but runDaemonWatchOnce calls renewDaemonReservations, which writes through runtime.renewWorkReservation for active reservations near expiry.","status":"ready","priority":"high","acceptanceCriteria":["Daemon watch either becomes explicitly opt-in for reservation renewal and reports writesTruth truthfully, or it stops mutating reservations.","Renewal requires ownership/heartbeat checks and emits clear operation/audit evidence.","Regression tests prove a default watch does not silently extend reservations while claiming observer-only behavior."],"labels":["hardening-pass-3","audit-2026-07-07","hardening","security","daemon","reservations","audit"],"dependencyIds":[],"evidenceIds":[],"verificationIds":[]}
