{"meta":{"id":"bw_work_bbd34b7ef6f302d8","schemaVersion":"boreal.runtime.v1","createdAt":"2026-07-03T20:43:02.790Z","updatedAt":"2026-07-04T07:02:17.669Z","createdBy":{"id":"cybertron","kind":"human","displayName":"cybertron"},"updatedBy":{"id":"cybertron","kind":"human","displayName":"cybertron"},"sourceRefs":[],"tags":["agent-loop-hardening","hardening-s3"],"contentHash":"sha256:c7db8b3f0945b725af0832f56b164924992802035275408f86853b7e4a2ccb37"},"kind":"sprint","title":"Hardening S3: Output diet and per-command latency","description":"Audited sessions streamed 20k+ lines of mostly repeated JSON (sync refresh 574-648 lines, evidence add 224 lines for a one-line note, work close 306-312 with postMutationWork duplicating work). Every --json command also loads the entire store plus a full sync probe for directive compilation (commands.ts:8734+). Depends on S2 directive scoping.","status":"closed","priority":"normal","acceptanceCriteria":["All child tasks closed with commit checkpoints","Envelope size budgets enforced in CI"],"labels":["agent-loop-hardening","hardening-s3"],"dependencyIds":["bw_work_339c40f5a2f5ff9a","bw_work_955684b17c4a9349","bw_work_963fc14a5f02f660","bw_work_c799e3ef3637122a","bw_work_fac43657d420760d","bw_work_2f07afe4a207a46f"],"evidenceIds":["bw_evidence_69f72199fccfb3fd"],"verificationIds":["bw_verification_9866699236d32fa2"],"closedAt":"2026-07-04T07:02:17.669Z","closedReason":"completed hardening S3 output diet and latency scope"}
